"CMS Page for Shipping Info","CMS-Seite für Versandinformationen"
"Display Block below Price","Anzeige zusätzlicher Info-Block unterhalb der Preisangabe"
"Display Delivery time on Category Pages","Anzeige der Lieferzeit auf der Kategorieseiten"
"Display Product Weight below Price","Anzeige des Gewichtes unter dem Preis"
"Display tax below Price","Steuerinformation unter Preis anzeigen"
"Display tax info and shipping cost link below the price on all pages","Unter Preis Steuer und Versandinformationen auf allen Seiten anzeigen"
"Display zero tax below Price","0% Steuerinformation unter Preis anzeigen"
"Display tax info below the price on all pages","Steuerinformation auf allen Seiten unter Preis anzeigen"
"Display zero tax info below the price on all pages","0% Steuerinformation auf allen Seiten unter Preis anzeigen"
"e.g. g, kg, lb, ...","z.B.: g, kg, pf, ..."
"No custom info","keine eigenen Informationen"
"Reference for business rules (physician, physician...)","Verweis auf berufliche Regelungen (z.B. für Ärzte, Apotheker)"
"Show ""incl. Shipping Cost"" instead of ""excl. Shipping Cost""","Anzeige ""incl. Versandkosten"" statt ""zzgl. Versandkosten"""
"Unit for Product Weight","Einheit für Produktgewicht"